{
  "apiVersion": "nexo/v1alpha1",
  "kind": "ImprovementProposal",
  "metadata": { "id": "scope-proposal", "title": "Scope Proposal", "version": "0.1.0" },
  "spec": {
    "observationRefs": ["Observation:scope-observation"],
    "changeSummary": "Clarify scope escalation guidance.",
    "requiresExplicitApproval": true,
    "evaluationPlan": ["Run regression evaluations", "Obtain independent review"],
    "target": "Rule:scope-rule"
  }
}
